Age Rating,Label,Rating,Number of Descriptions,Descriptions
age 7+,Violence & Scariness,2,91,"Stunts such as falling violently on the floor or crashing through the ceiling ar; Some players are more aggressive and impatient than others. Sometimes angry play; Forced servitude and captivity are featured in the series. Violence ensues with; Ghost Scratch is a silly villain who causes mischief and tries to scare people b; Some images of fire, mean faces, dragons blowing fire. References to Hades as a; There’s some fantasy violence, including blasting and throwing bombs in a video; Magical sticks, exploding potions, and energy-sapping contraptions are used to c; Frequent chase scenes and perilous scenarios, from which Kipo and friends narrow; Fantasy violence include chases, crashing, explosions, and people being shot int; When she's in dinosaur form as Gauko, our protagonist is quick to breathe fire a; Tasers shock people, causing them to appear as skeletons briefly, and emit charg; Supernatural concepts like spirits that possess people and mythological monsters; Some hand-to-hand exchanges, including punching, kicking, use of weapons like st; Lots of fantasy violence, ranging from space battles and explosions to chases an; Characters often find themselves in perilous situations from which they barely e; The Spy Kids' encounters with villains feature kicking, punching, and weapons th; Cartoon catastrophes like explosions, crashes, and falls are common, though seld; Mishaps cause things to crash and fall, but no one gets hurt. Fake pistols and o; Much cartoon violence, including crashes, smashes, punching, and some weapons li; Lots of Pokémon mishaps, ranging from accidental explosions to pinching people’s; Some fantasy violence, sneaky behavior, stealing. Also some dark images and char; Flashy battles with hitting, punching, kicking, and other impact. People are hur; Lots of cartoon-style violence with little consequence since the characters are; Mild fantasy violence but no one is injured. Sword fighting, a scary dragon. Vio; Some moments of peril for characters, as when three girls must outrun explosions; Many martial arts sequences with weapons like swords, axes, and a bo staff. Cart; Cartoon violence like explosions and crashes with little consequence. Rocket use; While there is no strong violence, there is a near-constant level of threat from; Robbers descend on travelers and intimidate them into turning over their belongi; Lots of action during battles and battle training. Explosions, gauntlets with sp; The warriors use a variety of magiswords to battle creatures (and sometimes each; Frequent swordplay and sparring, but Zorro never fights to hurt or kill, only to; Some scary and menacing creatures, many oversized. Kicking, punching, electric s; Blasters hit their targets, and it's assumed the victims die. When ships and obj; Many physical altercations. Characters are flung against walls and trees and kno; Many monsters and supernatural beings, including zombie fish, mummy monkeys, and; Monsters and aliens of all different shapes and sizes. Virus-infected humans tur; Scary, oversize monsters mean the knights and the general public harm. Knights f; Fantasy violence (crashes, explosions, and so on).; Some historical segments are set during war and in other times of battle, with e; Tense exchanges as the characters fight an oversize bully. They butt heads, cras; Cartoon violence includes images of monsters eating friendly characters; others; Lightsaber battles, blaster fire, and explosions that turn ships into a heap of; Star and Marco fight a rotating cast of monsters, many of whom carry weapons or; Frequent cartoon-style violence; getting hit on the head, flattened by a large o; Lemurs often are under attack from carnivorous Fossa, which attack the village a; Characters use a variety of weapons, depending on the story's setting, but there; Explosions, blasters, bombs, and flying objects never result in lasting injury.; These critters are destructive to their environment and everything in it. Animal; Lots of exchanges between campers that cast fighting in a funny light. One boy u; Rayguns shoot light beams that pierce ghosts, who self-heal in seconds. Others i; Some superhero play, but it's not the focal point of the show. Titans use knives; Mostly comic hitting, slapping, and other mayhem. Ray guns blast holes in walls; Most battles are fought with handheld weapons like spears, knives, and swords, t; Much cartoon violence among the characters. Crashes, fistfights, thumps to the h; The characters endure some bumps, crashes, explosions, knocks, and dismemberment; Lots of fantasy violence thanks to frequent dinosaur fight scenes. Dragons and d; Matt and his friends encounter danger from many villains who battle the heroes.; Some insults, disrespect, and antics. If there's any actual violence, it fal; Cartoon violence includes explosions, extensive falls, collisions, and the like,; Villains are robots who use blasters and sound waves in addition to brute force; Monsters of all shapes and sizes haunt the teens' town, but they're always revea; The duo's over-the-top adventures result in plenty of comic-style collisions and; Lots of typical consequence-free cartoon violence, including collisions, people; A fair number of animated fight scenes -- though none of it seems too intense, s; Standard cartoon violence -- extensive falls, collisions, and hand-to-hand battl; Club members use laser guns (which look more like toys than the real thing) agai; Fantasy violence; falls, explosions, etc. common; no one really gets hurt.; Soccer matches can be rough at times, but there’s nothing violent. Opposing team; Slapstick, cartoonish violence (like Bloo smashing himself into a Silly Putty-li; There's no blood, but frequent fantasy cartoon violence includes scenes of d; Brief cartoon battles are mostly contact-free, instead featuring exchanges of fl; Lots of goofy cartoon violence with no resulting injury: Chowder whacks Schnitze; Discussion of how bugs kill their prey: crunching limbs, leaving victims helples; Lots of lengthy clashes between the two sides, with some weapons and a lot of im; Each robot is equipped with special features that enable it to defend both itsel; People face perilous situations like house fires, avalanches, earthquakes, and c; Cartoon-style action violence, particularly in the case of ""Action League Now!""; Violence isn’t central to the plot, but there are some explosions, death-defying; The show’s slapstick style makes for some violent crashes, lengthy tumbles, deca; Pretty intense violence for a cartoon caper intended for young audiences: Mario; The two sides often exchange firepower between spacecraft and when they face off; Cartoonish violence, often involving laser-type weapons meant to contain ghosts.; Ghostbusters use a variety of weapons to eliminate ghosts, including a gun that; There is conflict and battle in each episode, but She-Ra often attempts to use r; Explosions, missile strikes, and gunfire in battle scenes. Space craft plummet f; Warring sides use handheld laser blasters and those on their spacecraft to take; He-Man uses a sword and a variety of other weapons, but most of his acts are in; Spider-Man fights the supervillain of the day, but this usually involves charact; There is usually some sort of battle against villains and their minions, but gen; There's a sense of menace thanks to the old-fashioned animation, but characters"
age 7+,Violence & Scariness,0,55,"No description found; Some cartoon-style mishaps (bumps and falls, mostly), but no actual violence or; Some teasing and insults between kids during soccer matches.; No description found; No description found; Some accidents that look painful, but nothing that injures. In at least one scen; Oversized monsters are more comical than they are scary, but there are some brie; Cartoon-style collisions, falls, and other accidents with little realistic effec; No violence, but some physical mishaps and accidents that are played for laughs; No description found; Danger is discussed, but nothing violent is shown.; Some cartoon-style injuries (a man is shown with multiple arrows protruding from; No description found; No description found; Some monster-like characters who are funnier than they are scary. In one scene,; No description found; There are some battles -- a princess karate-chops a bunch of evil robots, for in; There's no violence, but the girls have their share of mishaps since they're sti; No description found; Some falls and other physical humor, but no injuries.; Safety measures are discussed, and occasionally some athletes stumble or fall (b; No description found; No description found; Sometimes people get upset over things and cry or give out a yell.; Skateboarding spills and schoolyard scuffles are minor. Some mild physical humor; Some falls and other physical humor meant for laughs.; Cartoon-style crashes and bumps, but nothing that injures for long.; No description found; No description found; Toy cars are involved in crashes during races, but there's little emotion attach; No description found; Some slapstick cartoon violence exaggerated for humor -- long falls, collisions,; No description found; No description found; The duo's schemes sometimes end in typical cartoon explosions or falls from grea; No description found; No description found; No description found; No description found; Fascination with war and weapons.; Pranks and cartoon violence.; No description found; No description found; Some goofy roughhousing.; No description found; Some spats with hitting and other contact, but no injuries. Kidnappings are comm; No graphic violence, but Lloyd does get teased by the school bully.; No description found; No description found; No description found; Some gnarly wipeouts on skateboards, but no fighting. Characters wear safety gea; The characters sometimes get entangled with the forces of nature and the ferocit; One main character is a toughie who talks of getting into fights.; Ridiculous cartoon fights with mutants battling each other, helicopters and tank; There's little violence per se but plenty of spills and bumps that are playe"
age 7+,"Sex, Romance & Nudity",0,231,"No description found; No description found; No description found; No description found; No description found; No description found; No description found; No description found; No description found; No description found; No description found; No description found; No description found; No description found; No description found; No description found; No description found; No description found; No description found; No description found; No description found; No description found; No description found; No description found; No description found; No description found; No description found; Mike swoons whenever Iris is around and will try anything to win her affection.; No description found; No description found; No description found; No description found; No description found; No description found; No description found; No description found; No description found; No description found; No description found; One character often sheds his clothes, but any sensitive parts are covered.; No description found; No description found; No description found; No description found; No description found; No description found; Nothing sexy, but there are romantic tensions and jealousy between members of th; Characters appear shirtless when plot includes change of clothes.; Carmen swoons around her handsome teammate, Ace, but he doesn't seem to notice h; No description found; Rarely innuendo hinting at sensitive body parts, as when a woman asks a man, ""Oh; No description found; No description found; No description found; No description found; No description found; No description found; The Glitter Force outfits are short and clingy, accentuating curves and long lim; No description found; No description found; No description found; No description found; No description found; Some mild ribbing over a romantic crush.; No description found; No description found; No description found; Leo and Marcella share a kiss.; Mikey harbors a not-so-secret crush on his classmate Sophie, and he gets swoony; No description found; No description found; No description found; No description found; No description found; No description found; No description found; No description found; No description found; No description found; Zander remarks admiringly about Naare's appearance.; No description found; No description found; Some innocent romantic tension between Nya and other members of the group.; No description found; No description found; No description found; No description found; Very mild flirtation that will go over the heads of young viewers.; No description found; No description found; No description found; No description found; No description found; Some mildly suggestive humor, as when a man tempts Bugs Bunny by stuffing carrot; No description found; Goat gets starry-eyed when a handsome guy walks by.; No description found; No description found; No description found; Innocent references and teasing about being in love.; No description found; No description found; No description found; Veiled hints at procreating, as when Julien orders that the lemurs repopulate an; No description found; A character's crush on Sonic is played for laughs.; No description found; Teens flirt a bit and pair off to go to dances together, but there's nothing; No description found; No description found; No description found; Emperor Awesome is often seen flexing his sizable muscles or drawing attention t; No description found; No description found; No description found; Pinky has a crush on Pacster and believes the feeling is mutual, which leads her; No description found; No description found; No description found; No description found; No description found; Some mild attraction between members of the opposite text, but nothing sexual.; No description found; No description found; No description found; No description found; Lots of flirting and preening for the attention of the opposite sex. Men are sho; No description found; Some flirting among teens, and couples pair off to go to dances.; Nothing sexual, but in at least one case, a boy's butt crack is visible beneath; No description found; No description found; No description found; No description found; Se habla de citas, y cómo encontrar una mujer, y hay una referencia breve al amo; There's some attraction to young women in the village, but nothing overtly sexua; No description found; No description found; No description found; No description found; No description found; No description found; No description found; No description found; No description found; No description found; Crushes, getting girls discussed.; No description found; No description found; One of the characters is known as a ""super hottie"" -- but that's because he's ma; No description found; No description found; Dating, finding a woman, love briefly discussed.; No description found; No description found; Hint of adolescent crushes. Man seen in shower with bubbles covering privates.; No description found; Female heroes and villains wear tight, skimpy suits.; Some of the girls are a bit boy crazy.; No description found; No description found; No description found; No description found; No description found; A female classmate is called a ""hottie hot hottie.""; No description found; No description found; No description found; Lexi is the only female of the bunch, and she's sometimes portrayed in a provoca; In one episode the camera does a close-up on a female character's butt; villians; No description found; No description found; No description found; No description found; No description found; No description found; Queen Martian is a risqué dresser.; The kids are starting to develop crushes and ""like"" each other.; No description found; No description found; No description found; No description found; Nothing sexual, but the female warriors wear some skimpy, clingy outfits that sh; No description found; In stories that incorporate new cultures, indigenous people are shown in customa; No description found; Side characters may indulge in some mild innuendo.; No description found; No description found; No description found; No description found; No description found; Boy/girl relationships are mentioned, but nothing physical is shown.; No description found; As in so many shows of this ilk, the lead female character is buxom and scantily; Very tame romantic relationships among the characters.; No description found; No description found; No description found; No description found; Episodes have involved mating but not sex per se.; No description found; None shown, but a love affair between the playground monitor and custodian was f; No description found; A girl harbors a secret crush on a boy, often admitting in secret that she loves; No description found; Mild innuendo, particularly regarding She-Hulk, who occasionally also seduces (v; Some innuendoes, and some female characters have slightly risque body language a; No description found; No description found; No description found; Buxom female characters wear tight dresses that accentuate their curves, and som; No description found; No description found; No sex, though some of the female heroes wear moderately suggestive costumes.; Depends on the cartoon -- some include relatively mild innuendo.; Conan is usually seen in just a loincloth-style garment, which reveals his chise; No description found; No description found; Guest stars like Elvira occasionally show off major skin.; No description found; The guys' secretary Janine pines over Egon, just like in the original Ghostb; No description found; No description found; No description found; No description found; No description found; Veronica flaunts her crush on Archie, much to the irritation of Reggie, who'; No description found; No description found; No description found"
age 7+,"Sex, Romance & Nudity",1,42,"Theo has an innocent crush on a classmate named Isla.; Typical teen behavior, such as conversations about liking boys.; Crushes are explored.; There are references to players being ""good looking,"" but nothing sexual.; Angus' butt is shown briefly for comedic effect.; Very rarely suggestions to sexual content, as when a conversation hints at inapp; Romance is infrequent, but some characters express affection and attraction, lik; Mild flirtations that will go over the heads of younger viewers.; Calabrass uses some (curious, mild) innuendo: ""Don't stand there with your mouth; Alex has a girlfriend, but the relationship is innocent. Occasionally they hold; Some mild flirtation, a few kisses.; Teen girls wear short, tight clothing that shows off their lanky frames. Some sw; Teens flirt with each other. In some cases, girls come across as desperate for b; Teen girls get swoony when cute guys are around, and there's some flirting by bo; An oversized female character's most noticeable features are her disproportionat; There's some chemistry between Peter and Mary Jane (and at least one shared kiss; Some of the characters tease about romantic relationships. The girls in particul; Nya, Kai's younger sister, has a crush on Jay, the blue ""lightning"" ninja. The t; Some mild teen flirting, a couple of kisses, and girls often compete for boys&rs; Some flirting between teens, but nothing physical.; Sheen has a crush on a local girl, but mild flirting is as far as it goes.; Budding relationships between Daphne and Fred and Shaggy and Velma make for some; One female character wears a strapless dress that shows off her cleavage.; Nothing sexy, but a young girl is infatuated with a male friend, whom she thinks; Some female characters have voluptuous curves and large breasts, wear short skir; At least one reference to a kiss on the cheek. One character has an obvious crus; No sex or nudity, though Peter does have a major crush on one of his classmates.; Chowder is hounded by a young girl who claims to be his girlfriend and tries to; There is some attraction and tension between Rai and Sena. Characters talk about; Female game characters wear skimpy, tight outfits that accentuate their breasts; Mild flirtations, coaching by friends on how to flirt (mostly stammering and blu; Some very subtle innuendo (mostly in the form of verbal references); Some risque comments and innuendo from the grandmother, Suga Mama.; Thundergirl's strapless leotard accentuates her cleavage, and the Flesh is a nak; Rare, but not undeard of. For example, one segment features a silhouette of a na; A developing crush between Bravestarr and J.B. leads to some flirting and a coup; Female characters are shapely and well endowed, and their figures are accentuate; Very mild mentions of romance and marriage may occasionally occur; She-Ra's cost; No sexual content, but the lone female character's breasts are accentuated b; Healthcliff is portrayed as a ladies' man. Female cats tend to be portrayed as ""; Many of the characters wear tight clothing that accentuates their curves and bre; Mild insinuation as characters make advances on love interests. Some kissing, bu"
age 7+,"Sex, Romance & Nudity",2,9,"There are references to love and romance, and characters are seen kissing. In on; Nothing overtly sexual, but dolls and young girls are accessorized in glittery g; Donald calls Daisy ""Toots"" and gets hearts in his eyes when he talks to her. Her; Alvin fancies himself a ladies' man and often flirts with his classmates and cru; References to romance are on a grade school level, like when a male character fa; Female fans sometimes lavish attention on players, leading to lipstick marks on; For an 8-year-old boy, Cedric thinks a lot about girls and flaunts crushes on bo; Characters refer to ""copping a feel."" Female characters' suits tend to be skimpy; Many women have exaggeratedly large breasts and small waists. A woman is shown i"
age 7+,"Sex, Romance & Nudity",3,4,"The girls out-Barbie Barbie and the guys all look like body builders.; It's all about innuendo -- Johnny's mission is to get the babes, but why; Male characters ogle curvy females, and the ladies use their assets to distract; Romantic relationships are explored, and there's some contact between partne"
