Age Rating,Label,Rating,Number of Descriptions,Descriptions
age 4+,Positive Role Models,4,59,"Charlie Brown and Franklin are fantastic role models for how to initiate a new f; Mila has a loving father and caring friend in Morphle. Both she and Morphle love; Edmond and Lucy's dad is super kind. Throughout the series, the kids learn how t; Characters are realistic and relatable. Peppa, the lead, is always positive and; Characters are curious and adventurous. They use their mental skills, along with; Princess Rita, Princess Kira, Princess Bea, and Princess Penny are all strong-mi; All of the Action Pack characters are motivated by helping others and model kind; Main character Piper is a great role model. She understands the power of communi; Chip is a positive role model because she's never afraid to try new things or ma; Mira is a very positive role model. She is excited to take on a new challenge an; The show depicts a powerful girl protagonist who leads her team to save the day.; Pinkfong and Hogi work together to help their friends overcome various challenge; The story involves many examples of humility and and faith. Herod alone means ha; Mia and her friends are resourceful, determined, and cooperative. Their friends; The characters are friendly and helpful to each other, and they approach every p; Cody is a born problem solver, and she approaches every challenge with a can-do; Mira is determined and resourceful, and never meets a challenge she can't overco; True is resourceful, determined, always accepts help when it's offered. She is l; Kit is eager, determined, and fearless. She is inspired by the legacy of the ori; Wesley's grandma may be old, but she's feisty and full of wisdom. Georgie and We; True is thoughtful, kind, always chooses to see the best in people and the poten; Each character brings their unique personalities to the show: Snoopy is inventiv; Bandit and Chilli devote their time to their kids while maintaining professional; Main characters have exceedingly high respect for authority figures; they transl; Abby's generous spirit makes her a wonderful friend. She always makes time for t; Doc never disappoints as a role model for kids. She is selfless, compassionate,; Leo, Andy, Carmen, and Luna are enthusiastic students of other cultures and expe; Pete is a cat of few words but much action, as he's usually the first to roll up; Butterbean is a kind, effective leader who appreciates her friends' unique quali; Becca's eagerness for new experiences is infectious, and her friends get caught; Pete is surrounded by friends and family who go out of their way to help and gui; The family communicates well, and the parents set a good example for the childre; True's compassion is real and comes from a genuine place. She wants to help peop; Teri and Toby work well together, and their different styles and can-do attitude; The cadets can be impulsive at times, and when they don't give much thought; Ruff is insatiably curious and eager to find answers to his questions. It usuall; True is a kind and loyal friend who is quick to step in when someone needs her.; Rusty and Ruby approach every problem with a can-do attitude and pool their idea; Ruby is positive and likes to help her friends, encouraging and soothing them wh; Blaze and his friends are excellent role models; they're considerate and enc; Every Fresh Beat Band member is helpful, industrious, and committed to solving t; Miles is enthusiastic and always looking for ways to help on his family's mi; Poli and his rescuer friends hurry to scene of accidents with one thing in mind:; None of the characters is flawless, but they embrace the lessons they learn from; The Pod Squad members enjoy learning, taking on new challenges, and working toge; Bianca's mom is a strong mentor for her, helping her hone her magical skills; Wally and his friends are curious, helpful, and always eager to solve problems.; The kid characters are kind and help out animal friends in need, while adult rol; Even though the Night Wizard is called ""evil,"" he doesn't come acr; Most of the Treetopolis residents are kind-hearted and friendly, and each one br; The characters are exceedingly friendly, kind, and generous with their time and; The Berry Bitty City residents are always ready to help their neighbors in any w; Each team member brings a unique set of skills to the group, and his or her resp; The Doodlebops are supportive and understanding, and they encourage their friend; Dirtgirl and her friends thrive on sustainable living, demonstrating how they us; Paddington is polite, kind, and motivated by curiosity and a desire to help othe; Each of the four Little Einsteins of the title has his or her own special talent; Siblings are very courteous of one another's feelings and are articulate when ex; Harold's parents are clearly present in the house when Harold begins to drift of"
age 4+,Positive Role Models,3,59,"Mighty Bheem is curious, kind and respectful to his friends, animals and caretak; Chum Chum and Chinny are dedicated parents. The children are respectful, even wh; Pinocchio is a great friend. He make all of his friends feel important by lettin; The main character Piper is a great role model. She understands the power of sto; The Eggventurers work well together and are always willing to help.; All the characters on Big Tree City are positive role models because they work t; Face is an animated ""O.G. emoji,"" who has positive things to say about every sit; Marcie helps Peppermint Patty get to the root of her issues with Mother's Day. T; Main character Alice is a positive role model who names emotions, accepts respon; Minnie takes on a leadership role, helping her friends find their way back to ea; The adults in the ""mushable"" village of Mushton are respected for their experien; The ""adults"" like Gordon and Cranky can be stern when they speak to the younger; The Spidey team is diverse, including Miles as an Afro-Latinx kid,and incidental; Cory’s parents demonstrate the spirit of giving by welcoming a stranger in need; Mandy Mail puts her own desires over those of her new friends, and it threatens; Chico Bon Bon and his teammates work together toward a common goal. They solve p; Doug and Emma's contrasting personalities complement each other and inspire the; Chico Bon Bon and the Fix-It Force love to help others using creativity and engi; Dog and Pug are good friends and enjoy helping each other. They see the value in; Pete and his friends get along and care about each other, despite their differen; Forky's perpetual optimism endears him to everyone, audience included. His frien; Ricky Zoom is eager to be a full-grown rescue vehicle and help members of his co; Norman Picklestripes is extremely personable, is willing to help anyone at any t; Each dinosaur friend brings an important characteristic to the group. Mazo's ins; Arty believes that any problem can be fixed with a little creativity, and if the; Rangers' greatest asset is depth of concern they show for those who need their h; The Polos are all different kinds of animals of different ages, yet all six of t; Lou Bao Bei is a positive role model because she always experiences life to the; The Muppet Babies have big imaginations that help them explore the bigger world,; Pinkalicious is a born leader. She's opinionated, comfortable giving directi; Pirata is independent, determined, quick to jump at the hint of adventure. Her r; Jet is unfailingly curious and excited about learning, and his friends are patie; The farm animals want to give to Farmer Brown. Doug the Duck has ulterior motive; Rob's friend group is kind and they help each other out, and the people (and ali; Ollie and Moon are polar opposites in personality, but that's what makes them a; Go Jetters are quick to action when their services are needed, and they're resou; Digby and his friends are kind and helpful, and they welcome new experiences, es; Characters are generally kindly to each other; a couple are demanding or impetuo; Ranger Rob is responsible and is respectful of nature, visitors, and his parents; The monsters on the show are always willing to help any other monster who needs; Charlie Brown sometimes wallows in self-doubt, but his friends lift his spirits.; Noddy solves mysteries, helps his friends. Some characters can be vain, obnoxiou; Each of the characters is guilty of rash behavior and misjudgments at one time o; All the characters are friendly and kind, with the occasional exception of the B; Fishtronaut, Marina, and Zeek are curious about their world and eager to solve t; The birds are good friends and work as a team. Sparky is a good friend, too.; All the characters embrace adventure and like to help out. They're friendly, coo; Hazel, Lavender, and Posie have unique qualities that contribute to the group's; Kioka is confident and enthusiastic, and she is a good friend to her toys.; Booba wants to know everything about everything, and he learns it all by experie; All the characters have generous spirits, but none more than Dibo, thanks to his; Peter learns from his mistakes and shows a desire to make better decisions in th; Each of the characters is strong and wise in his own way, but each also has room; Pearlie is always happy to drop everything to help a friend, and she’s dedicated; Olivia isn't always patient, but she uses creativity and imagination to solve th; Willa herself is resourceful and spunky, and her animal friends are always depen; The Turbo Dogs deal with interpersonal issues that their young viewers will rela; Yakari embodies the joy, excitement, and curiosity of childhood, as well as a th; The five friends at the center of the story work together to create their mystic"
age 4+,Positive Role Models,0,2,"While the Teeniepings are central to the plot, their behavior often leads to mis; The characters are silly animal cars that don't talk."
age 4+,Positive Role Models,2,28,"Om Nom is a lovable creature that's always going after candy but doesn't usually; Bheem is a positive role model because he has a kind heart and views the world a; Snoopy has a positive outlook but sometimes seems indifferent to Charlie Brown.; StarBeam is brave and determined, and she asks for help when she needs it. She t; Entire cast is Indian, and the story celebrates the Hindu holiday of Holi. Bheem; Sam's optimism endears him to many around him, while Guy's pessimism generally h; Bheem is an energetic and inquisitive toddler who young viewers will find relata; Adult characters are involved in kids' experiences and, in a few cases in partic; Bheem sees the world as his playground and eagerly experiences all that it has t; YooHoo and his crew are kind, helpful, and curious. They all have different pers; The trio may make mistakes, but their intentions are good. They take responsibil; Spider-Man and his friends want to help people, including each other.; Poppy can be overly bossy and distrustful, sometimes lies to take advantage of C; The Vroomiz are generally supportive of each other. The female characters are st; Everyone's friendly in Hot Dog Hills, and newcomers are welcomed. Pete can act s; P. King Duckling means well but doesn't always think things through. His friends; Bunga is enthusiastic, curious, and excited about learning new things as he draw; Some Oddbods are more mischievous than others.; Gwen is self-assured and can be bossy at times, inadvertently taking advantage o; For the most part, Marin and his friends are left to their own devices, but when; Blythe is creative, goal-oriented, caring, and level-headed, and she stares down; The dog pack is a well-meaning group whose primary goal is to see homeless dogs; Guillermina is younger than Candelario but is the leader of the two. Both grandp; Geronimo's curiosity puts them on the trail of wrongs they can right, and he; As in most fairytales, characters are designated ""good"" or ""bad"" without much mo; The characters featured in these stories are positive ones, and when they make m; Fraggles are often kind and polite to each other; characters fit certain stereot; The Smurfs as a whole value sharing and cooperation. Individually, their persona"
age 4+,Positive Role Models,5,26,"Jaden communicates well, guiding Nate through the race. He encourages listening; Mira is a positive role model. She's smart, she cares about her friends, and she; Sam and Kit strive to help each other and their fellow animals. Their mission is; Santiago excels at being a leader because he appreciates what his crew members b; That Cory is such a good role model for kids is not surprising given the kind an; Not only are the Helpsters excellent models of kindness, those who bring their p; Pip and Freddy are fortunate to have a supervisor who believes in their unique a; Bubu, Bonie, and Biel are curious, eager to learn. They make new friends quickly; True is kindhearted and generous and always goes out of her way to make others h; There is no more devoted friend than True, and she is equally kindhearted to tho; You'd be hard pressed to find a better role model than Mama Llama. Her kind and; Igor and Esmie are nurturing and caring role models for their students. They sha; Jet and his friends are passionate about their interests, especially when it com; Luna takes initiative in identifying the mysteries she'd like to solve and in de; Fig and his friends enjoy spending time together, and they find joy in experienc; Lily personifies everything positive about childhood. She's curious, friendl; Ella and her friends value their friendship, respect their elders, and seek out; Arty is enthusiastic and always willing to help someone in need, and he never ba; Doc's parents encourage her dreams and desire to follow in the footsteps of her; Mike is helpful, hardworking, polite, and a good friend. He sets his sights on h; Mouk and Chavapa are curious, kind, and well-mannered, which allows them to lear; Franklin and his friends aren't without their faults, and sometimes problems; Doki and his friends are enthusiastic, inquisitive, and friendly. Each one has q; Mama and Papa are always ready to help kids make thoughtful decisions that refle; Wimzie has three influential adults in her life who guide and care for her. Thou; Babar regularly practices sharing and getting along with others, seeing creature"
age 4+,Positive Role Models,1,7,"Baby Shark is like most youngsters -- he can be impulsive and self-absorbed, but; Mamemo is enthusiastic and energetic, and he shares that excitement with viewers; The Bear is a model of patience and kindness, but Masha is incorrigible and glee; Peter's mother does her best to dissuade the kids from seeking out danger, b; Petunia is demanding and a little whiny, and she's slow to forgive naive Loopdid; Eloise is a typical child in many ways -- sometimes difficult and sometimes brat; Eloise's playful spirit and outgoing personality allow her to befriend a wide an"
age 4+,Educational Value,3,39,"Teaches kids how to make a new friend and continue to be a good friend.; Encourages very young children to think creatively problem solve.; Social-emotional lessons like how the joy of the holidays comes from giving to o; Each show highlights a different classic fairy tale, famous tale from mythology,; Teaches preschoolers the process of thinking through solutions to a problem.; The show contains some vocabulary words in Spanish, such as ""gracías,"" ""hola,"" ""; Mira models the process of using clues to make inferences that help her solve a; Mira's adventure showcases problem-solving skills.These skills include identifyi; Educational animated series: Vocabulary and facts, relevant to the animals featu; Characters model positive social-emotional skills.; Doug's experiences teach viewers about concepts and activities like riding a bik; The show’s focus is on social-emotional learning, and the characters’ experience; It shows how you can turn to books to find answers to questions and help solve p; Cory's experiences hold important lessons for preschoolers about skills like tak; The Helpsters' process shows kids the importance of attacking a problem with a p; The show teaches social-emotional skills like teamwork and problem-solving while; This series emphasizes basic safety skills like understanding and obeying traffi; Show incorporates some basic preschool skills like counting and color identifica; Emphasizes social and emotional learning for the preschool set by putting the ch; Most of the story follows Jet's learning about Christmas and its many tradit; With each journey, Ollie and Moon introduce viewers to different countries of th; Introduces viewers to basic concepts related to geography (coordinates, locating; While there are no technical lessons related to STEM subjects, the characters us; Clear, simple lessons offered about animals, natural habitats, ecosystems, and h; Teaches kids about problem-solving, investigating, experimenting, categorizing,; In each episode, the show compares two animals' similar characteristics, inc; The characters use basic science knowledge to solve problems, from assembling a; The series introduces kids to animal images, names, and characteristics (how the; Teaches the importance of using one's imagination and creative play. It also off; Each new adventure is rich in age-appropriate learning as the stories expose vie; Series demonstrates important work of rescuers, other community helpers. Charact; Many social lessons about relating to others and being responsible for your acti; Concepts of math, engineering, construction, and science feature prominently int; Kids learn about thinking outside the box to solve problems while being exposed; The characters' experiences offer opportunities to learn about their surroun; The show demonstrates the importance of using kindness and respect when working; Loving and protecting coastal habitats, marine life, the ocean, etc. The importa; Exposes kids to classical music and art, and demonstrates the value of friendshi; Some early literacy value in that the episodes bring to life some favorite child"
age 4+,Educational Value,2,45,"Episodes feature soft lessons on social-emotional learning like self-reflection; The princesses break gender stereotypes by having tea parties and playing dress-; The special exposed viewers to elements of Charles Dickens' classic novel, A Chr; Each episode gives an introduction to a topic, whether it's identifying birds by; The engines in this show have special capacities and specific jobs -- e.g., the; Each story centers on an element of social-emotional learning such as the value; The show introduces preschoolers to concepts related to efficiency in work effor; Series exposes kids to some basic STEM concepts like simple machines, air pressu; Mira's adventures expose viewers to problem-solving skills like identifying the; It’s entertaining, but teaches lessons about appreciating people’s differences t; Elements of Diwali, the festival of lights, a holiday celebrated by Hindus, Sikh; The show intends to entertain rather than to educate, but the story is rich in e; Incorporates simple facts about dinosaurs into the stories, such as what it mean; Social-emotional lessons include the importance of thinking creatively, teamwork; Strong messages about kindness and generosity as they relate to the season. The; Introduces basic kitchen concepts like mixing, pouring, cooking, plating. The fa; Underscores examples of positive social interactions as characters help each oth; The Wagtail Woods friends demonstrate teamwork, cooperation. They solve problems; The show intends to entertain, but it also shows Pete learning valuable life les; The characters frequently learn social and emotional lessons.; Positive representations of kindness, compassion, and concern for others.; Preschoolers see the characters identify a problem, gather clues, share ideas, a; Lou Bao Bei intends to entertain viewers rather than to educate. It does introdu; The show focuses on emotional development in the preschool set, using the kids&#; Kids can learn about basic concepts like music, pets, and dental hygiene.; Kids learn basic dance steps, rhythm, and directions like ""forward"" an; The show relates facts about nature in each episode: Elephants flap their ears t; Kids can learn problem-solving and critical thinking from Noddy's adventures; The series exposes kids to topics of outer space, including vocabulary such as &; Kids see Lily create adventures with things she finds all around her, and she al; Occasionally a story's content incorporates basic preschool skills such as c; The stories are rich in positive messages about helping others and believing in; Kids can learn facts about the natural world through songs and experiments they; The series includes basic knowledge related to the natural sciences and oceanogr; In addition to illustrating positive examples of problem solving and perseveranc; The show's unique content is designed to get kids up and moving during certa; The characters’ interactions hold good lessons for kids about the power of commu; Paddington's world travels introduce kids to unique aspects of different countri; The show isn't based on a particular curriculum, but kids will learn about t; The show teaches young viewers many important life lessons, but there's no speci; The show's changing settings introduce kids to different time periods and geogra; No specifically educational content, but lots of clear social lessons about shar; Models problem solving and getting past fears and challenges.; The series shows kids the value of self-expression and acknowledging your feelin; The series features popular children's stories that kids may be familiar with, m"
age 4+,Educational Value,0,38,"No description found; No description found; No description found; No description found; No description found; No description found; No description found; No description found; This series is intended to entertain rather than educate.; No description found; The story intends to entertain rather than to educate.; The show intends to entertain rather than to educate.; The story intends to entertain rather than to educate, but it does include messa; No description found; The series intends to entertain rather than to educate.; The show intends to entertain rather than to educate, but Kit's obsession with f; The series intends to entertain rather than to educate.; The show intends to entertain rather than to educate.; No description found; The story intends to entertain rather than to educate.; The show intends to entertain rather than to educate.; The show intends to entertain rather than to educate.; Intends to entertain rather than to educate.; No description found; No description found; This series is meant to entertain, not educate.; The show intends to entertain rather than educate.; The show intends to entertain rather than to educate.; The show intends to entertain rather than to educate, but there are positive mes; The show intends to entertain rather than to educate.; Show intends to entertain rather than to educate, but some stories introduce kid; The show intends to entertain rather than to educate.; Series intends to entertain rather than to educate, but kids do see the dinosaur; Intends to entertain rather than to educate.; This title is meant to entertain rather than to educate.; The show intends to entertain rather than to educate.; Intended to entertain, not educate, though there are some generally positive soc; No description found"
age 4+,Educational Value,4,14,"Academic lessons are offered in subjects like STEM, history, etc. as well as lea; Science lessons involving nature are integrated into the story. In the first epi; Kids showcase their talents by playing classical instruments like flute, violin; Each episode is a mission for Snoopy, and facts are shared throughout covering t; Teaches preschoolers, young kids about joy of exploration, wonders of diverse na; Lots of age-appropriate learning about various STEAM subjects.; The squad's monsters must use beginning math skills to get out of problems:; The process by which Doc diagnoses and treats her patients teaches kids critical; The series is brimming positive learning opportunities about getting along with; The series exposes viewers to different places in the world and the languages, c; The series increases kids' awareness of other cultures and exposes them to d; The show uses music and rhyme to teach kids simple steps for coping with everyda; The characters travel the world to discover where things come from and how they&; Kids learn about alternative energy, green living, caring for the Earth, and sus"
