Age Rating,Label,Rating,Number of Descriptions,Descriptions
age 5+,Positive Messages,1,17,"Friends help friends. Be yourself and good things will happen. Help one another.; This show focuses on presenting stories that are fun and funny, and so espousing; The gray creatures try to work together, but they never succeed.; Good and evil are easy to distinguish, even though the bad guys are more comical; There's little reality to the stories set in a high school teeming with mysterie; The main characters' relationship is the perfect example of how friends shouldn'; Kids see the characters' friendly actions toward one another and the good-na; This show is all about fun, putting the characters in ridiculous predicaments th; The shorts aren't out to promote anything but frivolous laughs, but they excel i; The show offers little in the way of meaningful content, but the relationship be; The series makes light of personality clashes between acquaintances and offers n; Kids see Henry throw tantrums over minor inconveniences such as going shopping f; Despite the wacky scenarios they put him through, Officer Piquel develops a deep; Some mixed messages. Dennis and his crew sometimes fight bad guys. But he is als; The gang wants to solve creepy mysteries because it helps people, and because it; Yes, it's all in fun, but Tom and Jerry do promote unhealthy competition and pok; The show presents good and evil in very simplistic terms and always gives Felix"
age 5+,Positive Messages,0,24,"Due to the extremely short nature of the episodes, there's usually only time for; Racial stereotypes are confusing.; Diversity is a theme throughout Buster's sojourns. But the animated female chara; The show's main characters are all white, with the exception of Scooby, a canine; No description found; Not strong on promoting good social behavior, but Buzz believes in justice.; Characters frequently hit one another in anger. It's cartoon violence, but nothi; Offbeat family dynamics. The son is more mature than his father, a wife browbeat; Lots of fighting betwen characters, but most of it is played for cartoon humor.; The male characters are dumb and miss obvious clues. The female characters, main; The ""bad guys"" never succeed, but the two groups of kids are constantl; No description found; In the Marmaduke cartoons, the mayhem invariably results not from bad intentions; The bad guys aren't every bad, and the good guys aren't very good. Several chara; Villains (who are often stereotypically foreign) are inevitably captured and pun; Hong Kong Phooey never improves, realizes that he's incompetent, or credits his; The bad guys (who are fairly stereotypical cartoon villains, often with indeterm; Some slight stereotyping reflects the show's original early-'70s era. Bu; Characters poke fun at each other and sometimes insinuate that they're stupid, b; The wolf never gets to eat the lamb. The villain never stops the hot air balloon; Heroes work as a team to fight villains. But no female or minority representatio; As the good guy, Atom Ant always wins out. But secondary accompanying cartoon sh; There's certainly no intentional social message here, but the ""good guy; Plenty of now-dated stereotypes: A sidekick character speaks in parody of a Mexi"
age 5+,Educational Value,3,19,"Children will learn about animals, the planet, and how to be more eco-friendly.; Great social-emotional lessons. Introduces the idea of being an introvert, copin; Lots of social-emotional learning, as well as some light science, like learning; Chinese words and phrases are used sporadically. Positive messages are promoted.; Viewers can learn about Mexican culture and some Spanish vocabulary.; The show mentions lots of academic topics like world history, trigonometry, and; It answers questions about going to space in ways that children can understand.; Chldren are taught about the history of some of the more culturaly diverse neigh; Stillwater teaches Michael, Addy, and Karl useful techniques for coping with dif; Characters teach positive social lessons.; Elinor and her friends learn by asking questions about the things they don’t kno; The series offers some details about different countries, states, cultures, and; Nancy's unreserved self-expression reminds kids that it's important to be true t; Stories center on basic STEM concepts like role of earthworms in a healthy ecosy; The show encourages kids' emotional awareness and exposes them to the challe; Science and space are discussed on a preschool level.; The show demonstrates craft and cooking projects kids can do mostly on their own; The show -- which is based on a series of fun and educational books -- encourage; The show encourages literacy by adapting children's picture books into narrated"
age 5+,Educational Value,4,11,"Each episode identifies an online and in-person problem and resolves it using te; The show's curriculum applies STEM (science, technology, engineering, and math); Teaches about Arbor Day and the importance of trees using observation and other; Teaches about Christmas gift giver traditions around the world like Tio de Nadal; Educates by exposure rather than direct instruction, letting viewers see and hea; This series is an excellent tool for introducing or expanding on scientific conc; The clear goal of this series is to teach viewers about the world around them. I; Dot shows kids how technology can be used as an effective learning tool. The ser; Viewers see the characters use their knowledge of math, an awareness of biodiver; The series exposes grade-schoolers to sophisticated words and their definitions,; Teaches about various aspects of Cree First Nation culture. Each episode teaches"
age 5+,Educational Value,1,24,"Because characters don't speak, viewers must discern the plot from their actions; Business majors won't learn much, but kids may grasp a lesson or two on business; The Looney Builders have to use executive function skills such as organization,; Chimps in the zoo use sign language to communicate with everyone.; Some lessons about social-emotional skills.; Viewers may be introduced to a handful of Walt Disney classics for the first tim; Similar to Sharkdog, Max, his two best friends, and Sharkdog embark on an advent; Not a lot of emphasis on educational content here. There are examples of social; Max, sometimes alongside his two best friends, regularly embarks on different ad; Some introduction to Makar Sankranti festival, but without dialogue to explain i; Intended to entertain rather than to educate, but the characters shed light on b; Viewers can take some very simple truths from elements of some of the stories an; Kids will see some aspects of life in the frontier west depicted.; Kids see the characters solve problems in creative ways using their skills with; Although a country is never specified, the show exposes viewers to various Latin; Kids learn some about the sights and sounds of the savannah and garner basic kno; Characters learn some basic lessons, but overall the show is intended to enterta; The show takes a unique approach to exposing viewers to common human practices,; Social-emotional lessons can be learned from each episode.; Some of the stories are set in locations around the world; others place the char; Strong messages about friendship and standing up for what's good and right.; The show's setting changes often, reflecting the topography, architecture, a; There’s nothing educational about the show, but it does incorporate life lessons; Kids learn that working together pays off and that it doesn't pay off to be"
age 5+,Educational Value,0,68,"No description found; No description found; No description found; The show is entertaining, but doesn't aim to educate.; No description found; No description found; No description found; No description found; No description found; No description found; No description found; No description found; No description found; No description found; Intended to entertain rather than educate.; The story’s focus is on entertaining rather than educating, but it does expose v; The series intends to entertain rather than to educate.; The show intends to entertain rather than to educate.; The series intends to entertain rather than to educate.; No description found; The show intends to entertain rather than to educate.; No description found; The show intends to entertain rather than to educate.; The show intends to entertain rather than to educate.; The show intends to entertain rather than to educate.; The show intends to entertain rather than to educate.; The show intends to entertain rather than to educate.; No description found; The show intends to entertain rather than to educate, but there are positive mes; This series intends to entertain, not educate.; While this story doesn't set out to educate per se, it does touch on the origins; The show intends to entertain rather than to educate.; It entertains more than educates.; The show intends to entertain rather than to educate, but it does make a point o; The show intends to entertain rather than to educate.; No description found; No description found; The show intends to entertain rather than to educate.; The show intends to entertain rather than to educate.; The show intends to entertain rather than to educate.; This show intends to entertain rather than to educate.; The show intends to entertain rather than to educate.; The series intends to entertain rather than to educate.; The show intends to entertain rather than to educate.; The show intends to entertain rather than to educate.; The show intends to entertain rather than to educate.; The show aims to entertain rather than to educate.; The show is intended to entertain, not educate, though there are some subtle mes; The show intends to entertain rather than to educate.; The show intends to entertain rather than educate.; No description found; The show is focused on entertainment, not education.; No description found; No description found; Kids can get a mild understanding of how a police force works, but that's about; The show in meant to entertain rather than educate.; The show intends to entertain rather than to educate.; The series is intended to entertain, but kids might be inspired to read the book; No description found; Even for the early '70s, this depiction of prehistoric times is remarkably i; You won't find any curriculum or thoughtful lessons here, but it's very entertai; Observant kids may learn that there is a book called Gulliver's Travels.; No description found; No description found; No description found; No description found; No description found; For every educational lesson Gumby teaches (It's too cold on the moon for Ea"
age 5+,Educational Value,2,20,"Some good social-emotional lessons, but may be lost amongst all the holiday exci; All of Baymax's health and medical advice is legit and helpful to characters.; Viewers will learn about the importance of working together and perseverance.; Lots of helpful social-emotional lessons about how to deal with emotions, teamwo; The main character, Dug, is a dog who's curious about the world around him, whic; Subtle science, technology, engineering, arts, and math (STEAM) lessons and lots; Socio-emotional lessons are offered about trying new things, perseverance, and l; Each episode has a social-emotional lesson that older Cedric shares with his dau; Series primarily intends to entertain, but does include some content that teache; The Rescue Bots' adventures teach viewers the value of self-confidence, teamwork; References to school projects and historical moments. Problem-solving skills are; It teaches about the importance of having rules, the consequences of one’s actio; The show introduces certain aspects of human behavior and the purposes of everyd; Characters must solve problems as a group, and teamwork proves invaluable in tha; The show focuses more on the act of experiencing nature than it does on teaching; The show intends to entertain rather than to educate, but there are good message; Similar to its parent series, this show integrates Spanish words and phrases int; Kids see how friendship can grow from rocky first impressions as Twilight learns; The show reminds kids that kindness and generosity are keys to getting ahead in; Ruby and her friends have adventures together that stress the virtues of coopera"
age 5+,Educational Value,5,2,"Teaches about major American cities like New York City, Seattle, and Oakland, an; This is an educational series that includes biographies of successful women. The"
age 5+,Diverse Representations,3,16,"Diversity is mostly limited to visual representation of human guests. Each episo; Animated characters range in age, gender, ethnicity and economic status. Nena's; Large female cast with range of personalities and interests shows that there are; There is diversity in the voice actors and amongst the animated pony friends. Di; One of the main characters is Black (and voiced by a Black actor). There's racia; The voice cast is diverse, with a number of Black voice actors. Robin is portray; Some key characters are people of color, including Robin (a young Black boy), Ba; Franklin, a Black child, is one of the few who speaks up against Lucy's false; Many in the voice cast are of Chinese descent, including legendary voice actor J; While the characters are all ponies, the special addresses issues of prejudice a; Brooklyn is a young Black female lead character, and even takes on the iconic na; Most characters are animals, but in the city scenes, human characters are racial; Very positive gender representation with the Leyla character -- she is strong an; This special emphasizes themes of friendship and collaboration. Three of the mai; The Inspiration4 team and the featured children are male and female, and from di; The show introduces Christmas traditions around the world. Some cultures represe"
age 5+,Diverse Representations,5,2,"Lyla and her family live in a diverse, welcoming community. The show highlights; Molly of Denali is the first PBS kids' show to star an Indigenous main character"
age 5+,Diverse Representations,1,5,"Characters are a mix of animals and humans. They represent a variety of personal; Though Santa is voiced by George Lopez, Santa's still portrayed as a White guy.; A few more females have been introduced, and Smurfette has more of a prominent d; Lamput was created in India, and some human characters appear Indian.; Majority of characters, cast, and crew are White, with two notable exceptions: F"
age 5+,Diverse Representations,0,5,"No description found; No description found; No description found; No description found; There are only animated ducks, no people, in this show."
age 5+,Diverse Representations,4,13,"Polly and her family are White. One of her two best friends is a Black girl. The; The series is inspired by Korean culture, and there are many nods to it within t; Celebrity guests (e.g., Lin-Manuel Miranda, Daveed Diggs, Brandi Carlile, and Sh; Chinese words and phrases are used. Yi's Chinese family is reopening a dumpling; Rosie's family is multicultural and mixed. Her mom is White, from Wisconsin, and; This series addresses the complexities of being Latina and succeeding in male-do; Main and background characters are racially and physically diverse. The series i; The Cyberchase crew is made up of Jackie, Inez, and Matt -- young scientists who; Strong diverse representation, including people and animals of different racial,; Ellen's main crew is racially, gender, and physically diverse (one BFF is smalle; Created by Nairobi-based media company Kukua alongside executive producer Lupita; The Bravest Knight centers around Cedric, a White man who's married to Prince An; After Disney's first botched attempt at a Latina princess, Elena Castillo Flores"
age 5+,Diverse Representations,2,10,"There are a few back background characters of color, including Franklin who is t; The two main characters are Barbie, who's White, and her best friend, Brooklyn,; The Looney Builders are animals of different shapes, sizes, and colors. They all; The ""berry besties"" represent various ethnic backgrounds.; Emphasizes themes of friendship and collaboration. Three of the show's recurring; Carl, the main human character, is an elderly White man. Dug and Russell, other; While the series teaches about both Chinese and American culture, it's filtered; The show casts dragons with a diverse roster of voice actors, but it lacks on-sc; Some racial diversity. Out of the three central characters, Polly and Isla are W; Shelley, a White woman, is the only person shown on camera, and the stories rang"
